<?xml version="1.0" encoding="UTF-8"?>
<!DOCTYPE catalog SYSTEM "../dtd/data.dtd"> <!-- Declares the DTD (Document Type Definition) for the XML document -->

<!-- Root element 'catalog' -->
<catalog authors="Aimar &amp; Ryan" 
    xmlns:xsi="http://www.w3.org/2001/XMLSchema-instance" 
    xsi:noNamespaceSchemaLocation="../xsd/data.xsd"> <!-- Location of the XML Schema Definition (XSD) -->

    <!-- Element 'brands' containing various brand elements -->
    <brands>
        <brand id="b001" location="Europe">TechMaster</brand> <!-- Brand information -->
        <brand id="b002" location="NorthAmerica">InnoBook</brand>
        <brand id="b004" location="Asia">GameBeast</brand>
        <brand id="b005" location="Africa">EvoTech</brand>
        <brand id="b008" location="SouthAmerica">SpeedLink</brand>
        <brand id="b009" location="Australia">PixelPro</brand>
        <brand id="b010" location="Antarctica">SoundSync</brand>
        <brand id="b011" location="Europe">BeatWave</brand>
    </brands>

    <!-- Element 'category' containing product categories -->
    <category>
        <categoryName>Laptops</categoryName> <!-- Category name -->
        <products> <!-- Products under 'Laptops' category -->
            <product id="p001" brand="b001"> <!-- Product information -->
                <productName>High-Performance Laptop</productName>
                <price>1499.99</price>
                <discount>300.00</discount> <!-- Optional discount -->
                <image>High-Performance_Laptop.png</image>
                <url>https://www.asus.com/es/laptops/for-creators/vivobook/vivobook-pro-16x-oled-k6604/</url>
            </product>
            <!-- Additional laptop products -->
        </products>
    </category>

    <!-- Additional categories and products (Smartphones and Audio Devices) follow with similar structure -->
</catalog>
